{"schemaVersion":"1.0","observedAt":"2026-10-14T05:10:36.163Z","benefitYear":2027,"status":"forecast","rate":{"displayed":3.5,"forecast":3.5,"computed":null,"official":null,"unit":"percent"},"cpiW":{"seriesId":"CWUR0000SA0","title":"CPI-W, U.S. city average, all items, not seasonally adjusted","unit":"index points (1982-84=100)","baseline":{"quarter":"2025-Q3","average":317.265},"observations":[{"month":"2026-07","value":327.104,"state":"published"},{"month":"2026-08","value":328.481,"state":"published"},{"month":"2026-09","value":null,"state":"pending"}]},"sources":{"cpiW":{"publisher":"U.S. Bureau of Labor Statistics","url":"https://www.bls.gov/developers/"},"retrievedVia":{"kind":"fred_api","label":"Federal Reserve Bank of St. Louis FRED API, BLS series CWUR0000SA0","url":"https://fred.stlouisfed.org/series/CWUR0000SA0"},"officialConfirmation":{"publisher":"U.S. Social Security Administration","url":"https://www.ssa.gov/OACT/COLA/latestCOLA.html"}},"ssaConfirmed":false,"notes":"September CPI-W is not yet available; the displayed rate remains an independent forecast."}